pnode_id,nucleus,satellite,original_relation,new_relation
140551922665176,"Social anxiety is strongly associated with self - perceived blushing, weakly associated with blushing as measured by physiological indices such as temperature and blood flow to the cheeks and forehead, and moderately associated with observed blushing. The relationship between physiological blushing and self - perceived blushing is small among those high in social anxiety, indicating that individuals with high social anxiety may overestimate their blushing. That social anxiety is associated most strongly with self - perceived blushing is also important for cognitive models of blushing and social anxiety, indicating that socially anxious individuals use both internal cues and other types of information to draw conclusions about how they are coming across. ","Individuals with social anxiety might also refrain from making eye contact, or constantly fiddling with things during conversations or public speaking. Other indicators are physical symptoms which may include rapid heartbeat, muscle tension, dizziness and lightheadedness, stomach trouble and diarrhea, unable to catch a breath, and - out of body - sensation. Attention bias ##Individuals who tend to experience more social anxiety turn their attention away from threatening social information and toward themselves, prohibiting themselves from challenging negative expectations about others and maintaining high levels of social anxiety. For example, a socially anxious individual may perceive rejection from a conversational partner, turn their attention away, and never learn that the individual is actually welcoming. Individuals who are high in social anxiety tend to show increased initial attention toward negative social cues, such as threatening faces, followed by attention away from these social cues, indicating a pattern of hypervigilance followed by avoidance. Attention in social anxiety has been measured using the dot - probe paradigm, which presents two faces next to one another. One face has an emotional expression and the other has a neutral expression, and when the faces disappear, a probe appears in the location of one of the faces. This creates a congruent condition in which the probe appears in the same location as the emotional face and an incongruent condition. Participants respond to the probe by pressing a button and differences in reaction times reveal attentional biases. This task has produced mixed results, with some studies finding no differences between socially - anxious individuals and controls, some studies finding avoidance of all faces by socially - anxious individuals, and other studies finding vigilance by socially - anxious individuals only toward threat faces. The Face - in - the - crowd task shows that individuals with social anxiety are faster at detecting an angry face in a predominantly neutral or positive crowd or slower at detecting happy faces than a non - anxious person. Focus on the self has been associated with increased social anxiety and negative affect. However, there are two types of self - focus : public and private. In public self - focus, one shows concern for the impact of one's own actions on others and their impressions. This type of self - focus predicts greater social anxiety. Other more private forms of self - consciousness ( e. g., egocentric goals ) are associated with other types of negative affect. Basic science research suggests that cognitive biases can be modified. Attention bias modification training has been shown to temporarily impact social anxiety. ",Joint,Topic-Change
140551922599976,"Individuals with social anxiety might also refrain from making eye contact, or constantly fiddling with things during conversations or public speaking. ","Other indicators are physical symptoms which may include rapid heartbeat, muscle tension, dizziness and lightheadedness, stomach trouble and diarrhea, unable to catch a breath, and - out of body - sensation. Attention bias ##Individuals who tend to experience more social anxiety turn their attention away from threatening social information and toward themselves, prohibiting themselves from challenging negative expectations about others and maintaining high levels of social anxiety. For example, a socially anxious individual may perceive rejection from a conversational partner, turn their attention away, and never learn that the individual is actually welcoming. Individuals who are high in social anxiety tend to show increased initial attention toward negative social cues, such as threatening faces, followed by attention away from these social cues, indicating a pattern of hypervigilance followed by avoidance. Attention in social anxiety has been measured using the dot - probe paradigm, which presents two faces next to one another. One face has an emotional expression and the other has a neutral expression, and when the faces disappear, a probe appears in the location of one of the faces. This creates a congruent condition in which the probe appears in the same location as the emotional face and an incongruent condition. Participants respond to the probe by pressing a button and differences in reaction times reveal attentional biases. This task has produced mixed results, with some studies finding no differences between socially - anxious individuals and controls, some studies finding avoidance of all faces by socially - anxious individuals, and other studies finding vigilance by socially - anxious individuals only toward threat faces. The Face - in - the - crowd task shows that individuals with social anxiety are faster at detecting an angry face in a predominantly neutral or positive crowd or slower at detecting happy faces than a non - anxious person. Focus on the self has been associated with increased social anxiety and negative affect. However, there are two types of self - focus : public and private. In public self - focus, one shows concern for the impact of one's own actions on others and their impressions. This type of self - focus predicts greater social anxiety. Other more private forms of self - consciousness ( e. g., egocentric goals ) are associated with other types of negative affect. Basic science research suggests that cognitive biases can be modified. Attention bias modification training has been shown to temporarily impact social anxiety. ",Joint,Joint
140551922667136,"Other indicators are physical symptoms which may include rapid heartbeat, muscle tension, dizziness and lightheadedness, stomach trouble and diarrhea, unable to catch a breath, and - out of body - sensation. ","Attention bias ##Individuals who tend to experience more social anxiety turn their attention away from threatening social information and toward themselves, prohibiting themselves from challenging negative expectations about others and maintaining high levels of social anxiety. For example, a socially anxious individual may perceive rejection from a conversational partner, turn their attention away, and never learn that the individual is actually welcoming. Individuals who are high in social anxiety tend to show increased initial attention toward negative social cues, such as threatening faces, followed by attention away from these social cues, indicating a pattern of hypervigilance followed by avoidance. Attention in social anxiety has been measured using the dot - probe paradigm, which presents two faces next to one another. One face has an emotional expression and the other has a neutral expression, and when the faces disappear, a probe appears in the location of one of the faces. This creates a congruent condition in which the probe appears in the same location as the emotional face and an incongruent condition. Participants respond to the probe by pressing a button and differences in reaction times reveal attentional biases. This task has produced mixed results, with some studies finding no differences between socially - anxious individuals and controls, some studies finding avoidance of all faces by socially - anxious individuals, and other studies finding vigilance by socially - anxious individuals only toward threat faces. The Face - in - the - crowd task shows that individuals with social anxiety are faster at detecting an angry face in a predominantly neutral or positive crowd or slower at detecting happy faces than a non - anxious person. Focus on the self has been associated with increased social anxiety and negative affect. However, there are two types of self - focus : public and private. In public self - focus, one shows concern for the impact of one's own actions on others and their impressions. This type of self - focus predicts greater social anxiety. Other more private forms of self - consciousness ( e. g., egocentric goals ) are associated with other types of negative affect. Basic science research suggests that cognitive biases can be modified. Attention bias modification training has been shown to temporarily impact social anxiety. ",Joint,Topic-Change
140551922601880,"Attention bias ##Individuals who tend to experience more social anxiety turn their attention away from threatening social information and toward themselves, prohibiting themselves from challenging negative expectations about others and maintaining high levels of social anxiety. ","For example, a socially anxious individual may perceive rejection from a conversational partner, turn their attention away, and never learn that the individual is actually welcoming. Individuals who are high in social anxiety tend to show increased initial attention toward negative social cues, such as threatening faces, followed by attention away from these social cues, indicating a pattern of hypervigilance followed by avoidance. Attention in social anxiety has been measured using the dot - probe paradigm, which presents two faces next to one another. One face has an emotional expression and the other has a neutral expression, and when the faces disappear, a probe appears in the location of one of the faces. This creates a congruent condition in which the probe appears in the same location as the emotional face and an incongruent condition. Participants respond to the probe by pressing a button and differences in reaction times reveal attentional biases. This task has produced mixed results, with some studies finding no differences between socially - anxious individuals and controls, some studies finding avoidance of all faces by socially - anxious individuals, and other studies finding vigilance by socially - anxious individuals only toward threat faces. The Face - in - the - crowd task shows that individuals with social anxiety are faster at detecting an angry face in a predominantly neutral or positive crowd or slower at detecting happy faces than a non - anxious person. Focus on the self has been associated with increased social anxiety and negative affect. However, there are two types of self - focus : public and private. In public self - focus, one shows concern for the impact of one's own actions on others and their impressions. This type of self - focus predicts greater social anxiety. Other more private forms of self - consciousness ( e. g., egocentric goals ) are associated with other types of negative affect. Basic science research suggests that cognitive biases can be modified. Attention bias modification training has been shown to temporarily impact social anxiety. ",Elaboration,Elaboration
140551922666632,"For example, a socially anxious individual may perceive rejection from a conversational partner, turn their attention away, and never learn that the individual is actually welcoming. ","Individuals who are high in social anxiety tend to show increased initial attention toward negative social cues, such as threatening faces, followed by attention away from these social cues, indicating a pattern of hypervigilance followed by avoidance. Attention in social anxiety has been measured using the dot - probe paradigm, which presents two faces next to one another. One face has an emotional expression and the other has a neutral expression, and when the faces disappear, a probe appears in the location of one of the faces. This creates a congruent condition in which the probe appears in the same location as the emotional face and an incongruent condition. Participants respond to the probe by pressing a button and differences in reaction times reveal attentional biases. This task has produced mixed results, with some studies finding no differences between socially - anxious individuals and controls, some studies finding avoidance of all faces by socially - anxious individuals, and other studies finding vigilance by socially - anxious individuals only toward threat faces. The Face - in - the - crowd task shows that individuals with social anxiety are faster at detecting an angry face in a predominantly neutral or positive crowd or slower at detecting happy faces than a non - anxious person. Focus on the self has been associated with increased social anxiety and negative affect. However, there are two types of self - focus : public and private. In public self - focus, one shows concern for the impact of one's own actions on others and their impressions. This type of self - focus predicts greater social anxiety. Other more private forms of self - consciousness ( e. g., egocentric goals ) are associated with other types of negative affect. Basic science research suggests that cognitive biases can be modified. Attention bias modification training has been shown to temporarily impact social anxiety. ",Elaboration,Topic-Change
140551922666352,"Individuals who are high in social anxiety tend to show increased initial attention toward negative social cues, such as threatening faces, followed by attention away from these social cues, indicating a pattern of hypervigilance followed by avoidance. ","Attention in social anxiety has been measured using the dot - probe paradigm, which presents two faces next to one another. One face has an emotional expression and the other has a neutral expression, and when the faces disappear, a probe appears in the location of one of the faces. This creates a congruent condition in which the probe appears in the same location as the emotional face and an incongruent condition. Participants respond to the probe by pressing a button and differences in reaction times reveal attentional biases. This task has produced mixed results, with some studies finding no differences between socially - anxious individuals and controls, some studies finding avoidance of all faces by socially - anxious individuals, and other studies finding vigilance by socially - anxious individuals only toward threat faces. The Face - in - the - crowd task shows that individuals with social anxiety are faster at detecting an angry face in a predominantly neutral or positive crowd or slower at detecting happy faces than a non - anxious person. Focus on the self has been associated with increased social anxiety and negative affect. However, there are two types of self - focus : public and private. In public self - focus, one shows concern for the impact of one's own actions on others and their impressions. This type of self - focus predicts greater social anxiety. Other more private forms of self - consciousness ( e. g., egocentric goals ) are associated with other types of negative affect. Basic science research suggests that cognitive biases can be modified. Attention bias modification training has been shown to temporarily impact social anxiety. ",Elaboration,Topic-Change
140551922664056,"Attention in social anxiety has been measured using the dot - probe paradigm, which presents two faces next to one another. One face has an emotional expression and the other has a neutral expression, and when the faces disappear, a probe appears in the location of one of the faces. This creates a congruent condition in which the probe appears in the same location as the emotional face and an incongruent condition. ","Participants respond to the probe by pressing a button and differences in reaction times reveal attentional biases. This task has produced mixed results, with some studies finding no differences between socially - anxious individuals and controls, some studies finding avoidance of all faces by socially - anxious individuals, and other studies finding vigilance by socially - anxious individuals only toward threat faces. The Face - in - the - crowd task shows that individuals with social anxiety are faster at detecting an angry face in a predominantly neutral or positive crowd or slower at detecting happy faces than a non - anxious person. Focus on the self has been associated with increased social anxiety and negative affect. However, there are two types of self - focus : public and private. In public self - focus, one shows concern for the impact of one's own actions on others and their impressions. This type of self - focus predicts greater social anxiety. Other more private forms of self - consciousness ( e. g., egocentric goals ) are associated with other types of negative affect. Basic science research suggests that cognitive biases can be modified. Attention bias modification training has been shown to temporarily impact social anxiety. ",Elaboration,Elaboration
140551922666184,Participants respond to the probe by pressing a button and differences in reaction times reveal attentional biases. ,"This task has produced mixed results, with some studies finding no differences between socially - anxious individuals and controls, some studies finding avoidance of all faces by socially - anxious individuals, and other studies finding vigilance by socially - anxious individuals only toward threat faces. The Face - in - the - crowd task shows that individuals with social anxiety are faster at detecting an angry face in a predominantly neutral or positive crowd or slower at detecting happy faces than a non - anxious person. Focus on the self has been associated with increased social anxiety and negative affect. However, there are two types of self - focus : public and private. In public self - focus, one shows concern for the impact of one's own actions on others and their impressions. This type of self - focus predicts greater social anxiety. Other more private forms of self - consciousness ( e. g., egocentric goals ) are associated with other types of negative affect. Basic science research suggests that cognitive biases can be modified. Attention bias modification training has been shown to temporarily impact social anxiety. ",Elaboration,Topic-Change
140551922666520,"This task has produced mixed results, with some studies finding no differences between socially - anxious individuals and controls, some studies finding avoidance of all faces by socially - anxious individuals, and other studies finding vigilance by socially - anxious individuals only toward threat faces. ","The Face - in - the - crowd task shows that individuals with social anxiety are faster at detecting an angry face in a predominantly neutral or positive crowd or slower at detecting happy faces than a non - anxious person. Focus on the self has been associated with increased social anxiety and negative affect. However, there are two types of self - focus : public and private. In public self - focus, one shows concern for the impact of one's own actions on others and their impressions. This type of self - focus predicts greater social anxiety. Other more private forms of self - consciousness ( e. g., egocentric goals ) are associated with other types of negative affect. Basic science research suggests that cognitive biases can be modified. Attention bias modification training has been shown to temporarily impact social anxiety. ",Elaboration,Topic-Change
140551922666968,The Face - in - the - crowd task shows that individuals with social anxiety are faster at detecting an angry face in a predominantly neutral or positive crowd or slower at detecting happy faces than a non - anxious person. ,"Focus on the self has been associated with increased social anxiety and negative affect. However, there are two types of self - focus : public and private. In public self - focus, one shows concern for the impact of one's own actions on others and their impressions. This type of self - focus predicts greater social anxiety. Other more private forms of self - consciousness ( e. g., egocentric goals ) are associated with other types of negative affect. Basic science research suggests that cognitive biases can be modified. Attention bias modification training has been shown to temporarily impact social anxiety. ",Elaboration,Topic-Change
140551922666912,Focus on the self has been associated with increased social anxiety and negative affect. ,"However, there are two types of self - focus : public and private. In public self - focus, one shows concern for the impact of one's own actions on others and their impressions. This type of self - focus predicts greater social anxiety. Other more private forms of self - consciousness ( e. g., egocentric goals ) are associated with other types of negative affect. Basic science research suggests that cognitive biases can be modified. Attention bias modification training has been shown to temporarily impact social anxiety. ",Contrast,Contrast
140551922665792,"However, there are two types of self - focus : public and private. In public self - focus, one shows concern for the impact of one's own actions on others and their impressions. This type of self - focus predicts greater social anxiety. ","Other more private forms of self - consciousness ( e. g., egocentric goals ) are associated with other types of negative affect. Basic science research suggests that cognitive biases can be modified. Attention bias modification training has been shown to temporarily impact social anxiety. ",Joint,Contrast
140551922666744,"Other more private forms of self - consciousness ( e. g., egocentric goals ) are associated with other types of negative affect. Basic science research suggests that cognitive biases can be modified. ",Attention bias modification training has been shown to temporarily impact social anxiety. ,Elaboration,Elaboration
140551922666800,"Other more private forms of self - consciousness ( e. g., egocentric goals ) are associated with other types of negative affect. ",Basic science research suggests that cognitive biases can be modified. ,Elaboration,Evaluation
140551922667360,that cognitive biases can be modified. ,Basic science research suggests ,Attribution,Attribution
140551922667080,"However, there are two types of self - focus : public and private. ","In public self - focus, one shows concern for the impact of one's own actions on others and their impressions. This type of self - focus predicts greater social anxiety. ",Elaboration,Elaboration
140551922665736,"In public self - focus, one shows concern for the impact of one's own actions on others and their impressions. ",This type of self - focus predicts greater social anxiety. ,Elaboration,Cause
140551922664784,one shows concern for the impact of one's own actions on others and their impressions. ,"In public self - focus, ",Elaboration,Background
140551922665960,that individuals with social anxiety are faster at detecting an angry face in a predominantly neutral or positive crowd or slower at detecting happy faces than a non - anxious person. ,The Face - in - the - crowd task shows ,Attribution,Attribution
140551922667192,that individuals with social anxiety are faster at detecting an angry face in a predominantly neutral or positive crowd ,or slower at detecting happy faces than a non - anxious person. ,Joint,Joint
140551922665008,"This task has produced mixed results, ","with some studies finding no differences between socially - anxious individuals and controls, some studies finding avoidance of all faces by socially - anxious individuals, and other studies finding vigilance by socially - anxious individuals only toward threat faces. ",Elaboration,Elaboration
140551922667248,"with some studies finding no differences between socially - anxious individuals and controls, ","some studies finding avoidance of all faces by socially - anxious individuals, and other studies finding vigilance by socially - anxious individuals only toward threat faces. ",Joint,Joint
140551922665064,"some studies finding avoidance of all faces by socially - anxious individuals, ",and other studies finding vigilance by socially - anxious individuals only toward threat faces. ,Joint,Contrast
140551922667416,Participants respond to the probe ,by pressing a button and differences in reaction times reveal attentional biases. ,Manner-Means,Manner-Means
140551922666688,by pressing a button ,and differences in reaction times reveal attentional biases. ,Joint,Cause
140551922663552,"Attention in social anxiety has been measured using the dot - probe paradigm, which presents two faces next to one another. ","One face has an emotional expression and the other has a neutral expression, and when the faces disappear, a probe appears in the location of one of the faces. This creates a congruent condition in which the probe appears in the same location as the emotional face and an incongruent condition. ",Elaboration,Elaboration
140551922664224,"One face has an emotional expression and the other has a neutral expression, and when the faces disappear, a probe appears in the location of one of the faces. ",This creates a congruent condition in which the probe appears in the same location as the emotional face and an incongruent condition. ,Elaboration,Cause
140551922663608,"One face has an emotional expression and the other has a neutral expression, ","and when the faces disappear, a probe appears in the location of one of the faces. ",Joint,Joint
